{
  "$schema": "https://baton.sawy3r.net/schemas/slice-status-v1.json",
  "slice_id": "S03-tui-chrome-rework",
  "release": "2026-07-01-render-drift-reconciliation",
  "track": "T2-tui",
  "state": "in_progress",
  "covers_needs": [
    "N-04"
  ],
  "spec_path": "docs/release/2026-07-01-render-drift-reconciliation/S03-tui-chrome-rework/spec.json",
  "start_commit": "0439b11740c5c1eb93ac3cfab0cfe68bc653fa0f",
  "effort_complexity": {
    "effort": "high",
    "complexity": "high",
    "quadrant": "epic",
    "rationale": "Wire WindowSizeMsg into Model, make pane widths responsive, add header, restyle help bar.",
    "confirmed_by_implementer": true
  },
  "verification": {
    "result": "pending"
  },
  "last_updated_by": "implementer",
  "last_updated_at": "2026-07-02T00:00:00Z"
}
