{
  "$schema": "https://baton.sawy3r.net/schemas/slice-status-v1.json",
  "slice_id": "S72-tui-gate-display",
  "release": "2026-06-19-safe-parallelism",
  "track": "T22-tui-gate",
  "covers_needs": [],
  "state": "in_progress",
  "owner": "implementer",
  "last_updated_by": "implementer",
  "last_updated_at": "2026-07-20T00:00:00Z",
  "start_commit": null,
  "planned_files": ["internal/tui/gate.go", "internal/tui/gate_test.go", "cmd/sworn/top.go"],
  "actual_files": [],
  "test_commands": ["go test ./internal/tui/...", "go build ./..."],
  "reachability_artifacts": [],
  "open_deferrals": [],
  "verification": { "result": "pending", "verifier_session_id": null, "verifier_verdict_at": null, "verifier_was_fresh_context": null, "violations": [] }
}
