{
  "$schema": "https://baton.sawy3r.net/schemas/slice-status-v1.json",
  "slice_id": "S09-driver-conformance-suite",
  "release": "2026-06-28-driver-contract",
  "track": "T3-validate-against-reference",
  "covers_needs": [
    "N-DRV"
  ],
  "state": "planned",
  "owner": "human",
  "last_updated_by": "planner",
  "last_updated_at": "2026-06-28T00:00:00Z",
  "start_commit": null,
  "spec_path": "docs/release/2026-06-28-driver-contract/S09-driver-conformance-suite/spec.md",
  "proof_path": "docs/release/2026-06-28-driver-contract/S09-driver-conformance-suite/proof.md",
  "journal_path": "docs/release/2026-06-28-driver-contract/S09-driver-conformance-suite/journal.md",
  "planned_files": [],
  "actual_files": [],
  "test_commands": [],
  "reachability_artifacts": [],
  "open_deferrals": [],
  "verification": {
    "result": "pending",
    "verifier_session_id": null,
    "verifier_verdict_at": null,
    "verifier_was_fresh_context": null,
    "violations": []
  }
}
