{
  "$schema": "https://baton.sawy3r.net/schemas/slice-status-v1.json",
  "slice_id": "S02-model-response-structured",
  "release": "2026-07-11-loop-operability",
  "track": "T1-conformance",
  "state": "design_review",
  "covers_needs": [
    "N-02"
  ],
  "spec_path": "docs/release/2026-07-11-loop-operability/S02-model-response-structured/spec.json",
  "start_commit": null,
  "effort_complexity": {
    "effort": "low",
    "complexity": "high",
    "quadrant": "puzzle",
    "rationale": "See spec.json; re-assess at design_review.",
    "confirmed_by_implementer": false
  },
  "verification": {
    "result": "pending"
  }
}
