{
  "$schema": "https://baton.sawy3r.net/schemas/slice-status-v1.json",
  "slice_id": "S12-record-migration",
  "release": "2026-06-28-driver-contract",
  "track": "T7-baton-revendor",
  "state": "planned",
  "covers_needs": ["N-13"],
  "spec_path": "docs/release/2026-06-28-driver-contract/S12-record-migration/spec.json",
  "start_commit": null,
  "effort_complexity": {
    "effort": "high",
    "complexity": "low",
    "quadrant": "grind",
    "rationale": "Mechanical repo-wide record sweep + renders + tolerance removal; breadth not depth; runs last in the release.",
    "confirmed_by_implementer": false
  },
  "verification": {
    "result": "pending"
  }
}
