{
  "$schema": "https://baton.sawy3r.net/schemas/slice-status-v1.json",
  "slice_id": "S16-journeys-attestations-align",
  "release": "2026-06-27-conformance-foundation",
  "track": "T4-records-as-json",
  "covers_needs": [
    "N-02"
  ],
  "state": "verified",
  "owner": "human",
  "last_updated_by": "implementer",
  "last_updated_at": "2026-07-25T03:15:00Z",
  "start_commit": "f9e064972f86b3da96ac85e5aff21223ab082991",
  "spec_path": "docs/release/2026-06-27-conformance-foundation/S16-journeys-attestations-align/spec.md",
  "proof_path": "docs/release/2026-06-27-conformance-foundation/S16-journeys-attestations-align/proof.md",
  "journal_path": "docs/release/2026-06-27-conformance-foundation/S16-journeys-attestations-align/journal.md",
  "planned_files": [
    "internal/journey/journey.go",
    "internal/journey/walkthrough.go",
    "internal/baton/schemas/journeys-v1.json",
    "internal/baton/schemas/attestations-v1.json"
  ],
  "actual_files": [
    "internal/journey/journey.go",
    "internal/journey/walkthrough.go",
    "internal/journey/journey_test.go",
    "internal/journey/walkthrough_test.go",
    "internal/journey/impact.go",
    "internal/baton/schemas/journeys-v1.json",
    "internal/baton/schemas/attestations-v1.json",
    "internal/baton/schemas/embed.go",
    "internal/baton/validator.go",
    "cmd/sworn/journeys.go"
  ],
  "test_commands": [
    "go test ./internal/journey/... -v"
  ],
  "reachability_artifacts": [
    "go test ./internal/journey/... -v exits 0 (51 tests PASS)"
  ],
  "open_deferrals": [],
  "verification": {
    "result": "pass",
    "verifier_session_id": "fresh-session-2026-07-28",
    "verifier_verdict_at": "2026-07-28T13:00:00Z",
    "verifier_was_fresh_context": true,
    "violations": []
  }
}
