{
  "$schema": "https://baton.sawy3r.net/schemas/slice-status-v1.json",
  "slice_id": "S06-model-pricing-registry",
  "release": "2026-06-30-sworn-operational-readiness",
  "track": "T5-model-pricing-registry",
  "state": "in_progress",
  "covers_needs": [
    "N-09"
  ],
  "spec_path": "docs/release/2026-06-30-sworn-operational-readiness/S06-model-pricing-registry/spec.json",
  "start_commit": "102ae04aa21725a4ee2f976c23ee84a9333332ab",
  "effort_complexity": {
    "effort": "low",
    "complexity": "low",
    "quadrant": "chore",
    "rationale": "Static pricing-map correctness fix across three maps (add claude-sonnet-5, correct claude-opus-4-8 $15/$75->$5/$25) plus test assertions. No dispatch-path logic, no dep, no schema change.",
    "confirmed_by_implementer": false
  },
  "verification": {
    "result": "pending"
  },
  "design_decisions": [
    {
      "choice": "Bring the three duplicate Anthropic pricing maps (Pricing, anthropicPricing, bedrockPricing) into agreement with static data edits only — add claude-sonnet-5, correct claude-opus-4-8 — rather than consolidating them into one canonical table.",
      "stake_class": "Type-2",
      "rationale": "Locally reversible, no schema/dependency/dispatch-logic change; map consolidation is the separately-tracked Type-1 model-layer service refactor (see project_model_layer_service_refactor memory), out of scope for this correctness slice."
    }
  ]
}
