{
  "$schema": "https://baton.sawy3r.net/schemas/slice-status-v1.json",
  "slice_id": "S01-llm-interpreter",
  "release": "2026-06-27-conformance-foundation",
  "track": "T1-orchestration",
  "covers_needs": [
    "N-10"
  ],
  "state": "implemented",
  "owner": "human",
  "last_updated_by": "implementer",
  "last_updated_at": "2026-06-27T23:01:47Z",
  "start_commit": "6be6054ab49c84bc0bd1498eba9937f90eff721b",
  "spec_path": "docs/release/2026-06-27-conformance-foundation/S01-llm-interpreter/spec.md",
  "proof_path": "docs/release/2026-06-27-conformance-foundation/S01-llm-interpreter/proof.md",
  "journal_path": "docs/release/2026-06-27-conformance-foundation/S01-llm-interpreter/journal.md",
  "planned_files": [
    "internal/orchestrator/interpreter.go",
    "internal/orchestrator/interpreter_test.go",
    "internal/scheduler/worker.go"
  ],
  "actual_files": [
    "internal/orchestrator/interpreter.go",
    "internal/orchestrator/interpreter_test.go",
    "internal/run/slice.go",
    "internal/scheduler/worker.go",
    "internal/scheduler/worker_test.go"
  ],
  "test_commands": [
    "go test ./internal/orchestrator/... ./internal/scheduler/... -v -run TestInterpreter"
  ],
  "reachability_artifacts": [
    "go test ./internal/orchestrator/... ./internal/scheduler/... -v -run TestInterpreter exits 0"
  ],
  "open_deferrals": [],
  "verification": {
    "result": "pending",
    "verifier_session_id": null,
    "verifier_verdict_at": null,
    "verifier_was_fresh_context": null,
    "violations": []
  }
}
