{
  "$schema": "https://baton.sawy3r.net/schemas/slice-status-v1.json",
  "slice_id": "S73-baton-v0.5.0-pin",
  "release": "2026-06-19-safe-parallelism",
  "track": "T14-baton-integration",
  "covers_needs": [],
  "state": "implemented",
  "owner": "human",
  "last_updated_by": "implementer",
  "last_updated_at": "2026-07-15T12:00:00Z",
  "start_commit": "84ebacd",
  "spec_path": "docs/release/2026-06-19-safe-parallelism/S73-baton-v0.5.0-pin/spec.md",
  "proof_path": "docs/release/2026-06-19-safe-parallelism/S73-baton-v0.5.0-pin/proof.md",
  "journal_path": "docs/release/2026-06-19-safe-parallelism/S73-baton-v0.5.0-pin/journal.md",
  "planned_files": [
    "internal/adopt/baton/VERSION",
    "internal/adopt/baton/rules/*.md",
    "internal/adopt/baton/role-prompts/*.md"
  ],
  "actual_files": [
    "internal/adopt/baton/VERSION",
    "internal/adopt/baton/architecture.json",
    "internal/adopt/adopt.go",
    "internal/baton/source.go",
    "internal/baton/transform.go",
    "internal/baton/fetch.go",
    "internal/baton/fetch_test.go",
    "internal/baton/vendor_test.go",
    "cmd/sworn/baton_test.go",
    "internal/prompt/prompt_test.go"
  ],
  "test_commands": [
    "go test ./internal/prompt/...",
    "go test ./internal/adopt/...",
    "go test ./internal/baton/..."
  ],
  "reachability_artifacts": [
    "sworn version output: baton-protocol on Baton v0.5.0"
  ],
  "open_deferrals": [],
  "verification": {
    "result": "pending",
    "verifier_session_id": null,
    "verifier_verdict_at": null,
    "verifier_was_fresh_context": null,
    "violations": []
  }
}
