{
  "$schema": "https://baton.sawy3r.net/schemas/slice-status-v1.json",
  "slice_id": "S66-lint-coverage",
  "release": "2026-06-19-safe-parallelism",
  "track": "T20-gate-engine",
  "covers_needs": [],
  "state": "planned",
  "owner": "human",
  "last_updated_by": "planner",
  "last_updated_at": "2026-06-25T11:00:00Z",
  "start_commit": null,
  "spec_path": "docs/release/2026-06-19-safe-parallelism/S66-lint-coverage/spec.md",
  "proof_path": "docs/release/2026-06-19-safe-parallelism/S66-lint-coverage/proof.md",
  "journal_path": "docs/release/2026-06-19-safe-parallelism/S66-lint-coverage/journal.md",
  "planned_files": ["internal/gate/coverage.go", "internal/gate/coverage_test.go", "cmd/sworn/lint.go"],
  "actual_files": [],
  "test_commands": ["go test ./internal/gate/...", "go build ./..."],
  "reachability_artifacts": [],
  "open_deferrals": [],
  "verification": { "result": "pending", "verifier_session_id": null, "verifier_verdict_at": null, "verifier_was_fresh_context": null, "violations": [] }
}
