{
  "$schema": "https://baton.sawy3r.net/schemas/slice-status-v1.json",
  "slice_id": "S24-dispatch-enrich",
  "release": "2026-06-27-conformance-foundation",
  "track": "T7-telemetry-eval",
  "covers_needs": [
    "N-26"
  ],
  "state": "implemented",
  "owner": "human",
  "last_updated_by": "implementer",
  "last_updated_at": "2026-06-27T23:06:01Z",
  "start_commit": "e74b5ddd7df29b89e13c30b0dc49e1c6334cff34",
  "spec_path": "docs/release/2026-06-27-conformance-foundation/S24-dispatch-enrich/spec.md",
  "proof_path": "docs/release/2026-06-27-conformance-foundation/S24-dispatch-enrich/proof.md",
  "journal_path": "docs/release/2026-06-27-conformance-foundation/S24-dispatch-enrich/journal.md",
  "planned_files": [
    "internal/state/state.go",
    "internal/run/slice.go",
    "internal/model/oai.go",
    "internal/model/anthropic.go"
  ],
  "actual_files": [
    "internal/state/state.go",
    "internal/run/slice.go",
    "internal/model/oai.go",
    "internal/model/anthropic.go",
    "internal/model/client.go",
    "internal/verdict/verdict.go",
    "internal/verify/verify.go",
    "internal/model/google.go",
    "internal/model/bedrock.go",
    "internal/model/ollama.go",
    "internal/model/oci.go",
    "internal/model/azure.go",
    "internal/model/openai_responses.go",
    "internal/model/cli.go",
    "internal/reqverify/reqverify.go",
    "internal/implement/ready.go",
    "internal/gate/llmcheck.go"
  ],
  "test_commands": [
    "go test ./internal/state/... ./internal/run/... -v"
  ],
  "reachability_artifacts": [],
  "open_deferrals": [],
  "verification": {
    "result": "pending",
    "verifier_session_id": null,
    "verifier_verdict_at": null,
    "verifier_was_fresh_context": null,
    "violations": []
  }
}
