{
  "$schema": "https://baton.sawy3r.net/schemas/slice-status-v1.json",
  "slice_id": "S10-conformance-sit",
  "release": "2026-06-28-driver-contract",
  "track": "T6-proof",
  "state": "design_review",
  "covers_needs": ["N-07"],
  "spec_path": "docs/release/2026-06-28-driver-contract/S10-conformance-sit/spec.json",
  "start_commit": null,
  "effort_complexity": {
    "effort": "high",
    "complexity": "high",
    "quadrant": "epic",
    "rationale": "Hermetic SIT over a cold board is exactly where the 2026-06-28 eval's twelve novel bugs lived; deterministic CI harness is genuinely hard.",
    "confirmed_by_implementer": false
  },
  "verification": {
    "result": "pending"
  }
}
